id,name,description,is_fixed,rule,country,created_at
9859539c-25cc-438b-8457-e69e3d44cb1d,Tag des Teddybären-Picknicks,"Teddy Bears’ Picnic Day – Ein verspielter Gedenktag, besonders für Kinder, die ihre Plüschtiere zum Essen im Freien mitnehmen.",true,"{""day"": 10, ""month"": 7}",INT,2026-01-15 08:44:45.704242+01
d2c71c82-7eee-43d5-b054-fb468347ba73,Tag der Verfassung (Mauritius),Erinnert an die Einführung der Selbstverwaltung im Jahr 1964.,true,"{""day"": 10, ""month"": 7}",MU,2026-01-15 08:44:45.704242+01
81d8a57a-602a-4a7e-ad47-c6f5144462eb,Tag der Pizza mit allem außer Sardellen,"National Pizza Day (Specialty) – Ein humorvoller kulinarischer Nischentag für alle Pizza-Fans, die keine Sardellen mögen.",true,"{""day"": 10, ""month"": 7}",US,2026-01-15 08:44:45.704242+01
4ca535fa-3139-4b57-a012-1dde680e32ae,Weltbevölkerungstag,"Ein von der UN ausgerufener Tag, um auf die Herausforderungen und Chancen des globalen Bevölkerungswachstums aufmerksam zu machen.",true,"{""day"": 11, ""month"": 7}",INT,2026-01-15 08:51:02.570015+01
b09375a5-7040-45da-a288-ca041d72a5b8,Tag der einsamen Herzen,"All American Pet Photo Day / Cheer Up the Lonely Day – Ein Tag, um einsamen Menschen eine Freude zu machen oder Zeit zu schenken.",true,"{""day"": 11, ""month"": 7}",INT,2026-01-15 08:51:02.570015+01
0541a778-776f-4d51-82f2-ef3faf11186a,Tag der Blaubeermuffins,National Blueberry Muffin Day – Ein kulinarischer Gedenktag zu Ehren des beliebten Gebäcks.,true,"{""day"": 11, ""month"": 7}",US,2026-01-15 08:51:02.570015+01
6c7665eb-2a9f-4a9b-982f-75c0579ac06f,Tag der Slurpees (7-Eleven Day),"Ein Marketing-Feiertag, an dem die Kette 7-Eleven oft kostenlose Slurpees verteilt, passend zum Datum 7/11.",true,"{""day"": 11, ""month"": 7}",INT,2026-01-15 08:51:02.570015+01
95864645-96e7-4efa-ba4e-b649d5c12bef,Gedenktag des Heiligen Benedikt von Nursia,Der Schutzpatron Europas und Ordensgründer der Benediktiner wird an diesem Tag besonders geehrt.,true,"{""day"": 11, ""month"": 7}",EU,2026-01-15 08:51:02.570015+01
df6f1a0a-20e5-4ec1-a785-b23877f5aee4,Tag des freien Schwimmens im Meer,"Ein Tag, der dazu einlädt, die Freiheit und die Natur beim Schwimmen in offenen Gewässern zu genießen.",true,"{""day"": 11, ""month"": 7}",INT,2026-01-15 08:51:02.570015+01
bea84806-5b54-4b80-a69c-e83cadf758fa,Tag der Verfassung (Mongolei),"Beginn des Naadam-Festes, dem wichtigsten Nationalfeiertag der Mongolei mit traditionellen Sportarten.",true,"{""day"": 11, ""month"": 7}",MN,2026-01-15 08:51:02.570015+01
2e5cd190-6dfe-41a9-9164-21d651564b53,Malala-Tag,"Von den Vereinten Nationen ausgerufen, um das Recht auf Bildung für alle Kinder zu fordern; am Geburtstag von Malala Yousafzai.",true,"{""day"": 12, ""month"": 7}",INT,2026-01-15 08:51:02.570015+01
35acbf10-229d-4bae-937a-9ee016dc7d2e,Tag der Einfachheit,"Simplicity Day – Gedenktag zu Ehren des Autors Henry David Thoreau, der für ein einfacheres, naturverbundenes Leben plädierte.",true,"{""day"": 12, ""month"": 7}",INT,2026-01-15 08:51:02.570015+01
0b72462c-03b9-4d6d-86b8-b449b035f17d,Tag der Unabhängigkeit (Kiribati),Nationalfeiertag zur Erinnerung an die Erlangung der Unabhängigkeit vom Vereinigten Königreich im Jahr 1979.,true,"{""day"": 12, ""month"": 7}",KI,2026-01-15 08:51:02.570015+01
34132c56-a5b4-42f6-a1e1-7bf8af5e6851,Tag der Unabhängigkeit (São Tomé und Príncipe),Gedenktag an die Unabhängigkeit von Portugal im Jahr 1975.,true,"{""day"": 12, ""month"": 7}",ST,2026-01-15 08:51:02.570015+01
d11e9f1f-3e58-496a-928e-9e9d2bb36e6f,Pekannuss-Torte-Tag,National Pecan Pie Day – Ein kulinarischer Gedenktag zu Ehren des klassischen amerikanischen Kuchens.,true,"{""day"": 12, ""month"": 7}",US,2026-01-15 08:51:02.570015+01
556140c6-db4a-4da0-b24d-e05f8fb00a60,Papierbeutel-Tag,Paper Bag Day – Erinnert an die Patentierung der ersten Maschine zur Herstellung von Papiertüten im Jahr 1859.,true,"{""day"": 12, ""month"": 7}",INT,2026-01-15 08:51:02.570015+01
bd554605-90d7-4840-b902-5b97bb092498,Oranier-Tag (The Twelfth),Ein nordirischer Gedenktag zur Erinnerung an die Schlacht am Boyne im Jahr 1690.,true,"{""day"": 12, ""month"": 7}",UK-NIR,2026-01-15 08:51:02.570015+01
02e0a550-e8fe-4456-b474-8a9055e55d66,Tag der Pommes Frites,National French Fry Day – Ein kulinarischer Ehrentag für eine der weltweit beliebtesten Beilagen.,true,"{""day"": 13, ""month"": 7}",INT,2026-01-15 08:51:02.570015+01
178e28c0-6ff4-4925-b22f-d69b3a26141c,Rock-am-Radio-Tag,"Gedenktag an das legendäre Live-Aid-Konzert vom 13. Juli 1985, das gleichzeitig in London und Philadelphia stattfand.",true,"{""day"": 13, ""month"": 7}",INT,2026-01-15 08:51:02.570015+01
2a4840ae-a349-4434-9a78-73c1e3f2a90a,Tag der Fleischklößchen,"National Meatball Day (mancherorts auch im März) – Ein Festtag für Fans von Köttbullar, Polpette und Co.",true,"{""day"": 13, ""month"": 7}",INT,2026-01-15 08:51:02.570015+01
0aa73cfb-8b7e-4dcb-833d-50a2edcd16e2,Tag des Staates (Montenegro),Nationalfeiertag zur Erinnerung an den Beginn des Aufstands gegen die Besatzer 1941 und die Anerkennung der Unabhängigkeit 1878.,true,"{""day"": 13, ""month"": 7}",ME,2026-01-15 08:51:02.570015+01
036daba9-c4a6-43e9-91b6-0132687a8394,Gedenktag des Heiligen Heinrich II.,"Gedenktag des heiligen Kaisers des Heiligen Römischen Reiches, Patron der Stadt Bamberg.",true,"{""day"": 13, ""month"": 7}",DE,2026-01-15 08:51:02.570015+01
360f05a4-af8b-4519-b39c-150e62537265,Umarme-deinen-Geek-Tag,"Embrace Your Geekness Day – Ein Tag, um zu seinen speziellen Hobbys und Leidenschaften zu stehen.",true,"{""day"": 13, ""month"": 7}",INT,2026-01-15 08:51:02.570015+01
19beadaa-4120-4f39-9111-03e5ad96146e,Tag der Bohne,National Bean Day – Zur Wertschätzung von Hülsenfrüchten als nachhaltige Proteinquelle.,true,"{""day"": 13, ""month"": 7}",INT,2026-01-15 08:51:02.570015+01
1cd6cebf-ed8c-4add-a3cf-0d79bfcd658e,Nationalfeiertag Frankreich (Bastille-Tag),"Gedenktag an den Sturm auf die Bastille 1789, ein zentrales Ereignis der Französischen Revolution.",true,"{""day"": 14, ""month"": 7}",FR,2026-01-15 08:51:02.570015+01
f7d0ea64-486b-449a-9935-506705f48412,Welt-Schimpansen-Tag,"Ein Aktionstag zu Ehren unserer nächsten Verwandten, initiiert am Jahrestag von Jane Goodalls Ankunft im Gombe-Stream-Nationalpark.",true,"{""day"": 14, ""month"": 7}",INT,2026-01-15 08:51:02.570015+01
14982168-b2bc-45c4-a329-66bf34583206,Internationaler Non-Binary People’s Day,"Ein Tag zur Sichtbarkeit und Feier von Menschen, die sich außerhalb der zweigeteilten Geschlechterordnung identifizieren.",true,"{""day"": 14, ""month"": 7}",INT,2026-01-15 08:51:02.570015+01
27c23f92-6e6d-48b1-8f22-9cc2241c1c50,Tag des Haifischbewusstseins,Shark Awareness Day – Ein Tag zur Aufklärung über die ökologische Bedeutung von Haien und gegen ihre Stigmatisierung.,true,"{""day"": 14, ""month"": 7}",INT,2026-01-15 08:51:02.570015+01
f9066689-c2d1-4667-9269-3a210b7c313d,Tag des Pandemoniums,"Pandemonium Day – Ein humorvoller Tag, um das kreative Chaos im Leben zu feiern und sich von starren Plänen zu befreien.",true,"{""day"": 14, ""month"": 7}",INT,2026-01-15 08:51:02.570015+01
e556ed0f-b95b-4f6f-be27-487897303f15,Tag der Makkaroni mit Käse,"National Mac and Cheese Day – Ein kulinarischer Gedenktag für eines der beliebtesten ""Comfort Foods"" weltweit.",true,"{""day"": 14, ""month"": 7}",US,2026-01-15 08:51:02.570015+01
4cf9be22-845c-4ad4-88e5-5b80671febfd,Gedenktag des Heiligen Kamillus von Lellis,"Patron der Kranken, Krankenhäuser und des Pflegepersonals.",true,"{""day"": 14, ""month"": 7}",INT,2026-01-15 08:51:02.570015+01
5369ef0f-4f72-48cb-9bb9-bde940210648,Welttag für den Kompetenzentwicklungsbedarf Jugendlicher,"Ein von der UN ausgerufener Tag, um die Bedeutung der beruflichen Bildung und Qualifizierung junger Menschen hervorzuheben.",true,"{""day"": 15, ""month"": 7}",INT,2026-01-15 08:51:02.570015+01
4d0b9a7a-63a3-4479-8e7e-538322432845,Tag der Demokratie und nationalen Einheit (Türkei),Gedenktag zur Erinnerung an den gescheiterten Putschversuch vom 15. Juli 2016.,true,"{""day"": 15, ""month"": 7}",TR,2026-01-15 08:51:02.570015+01
37b2ef63-855b-4568-aad1-93ae48e04e9c,Tag des Gummi-Entchens,"Ein kurioser Feiertag zu Ehren des klassischen gelben Badespielzeugs, das weltweit Kultstatus genießt.",true,"{""day"": 15, ""month"": 7}",INT,2026-01-15 08:51:02.570015+01
0cc714ac-4128-4caf-9c80-107ce1845890,Tag der Tapioka-Perlen,National Tapioca Pudding Day (Ersatztermin) – Ein kulinarischer Gedenktag für die vielseitigen Stärkekugeln.,true,"{""day"": 15, ""month"": 7}",INT,2026-01-15 08:51:02.570015+01
d3d4a4a2-d650-4ab4-a26d-36281f51954a,Tag des Haustier-Feuerlöschers,"Pet Fire Safety Day – Ein Aktionstag, der Tierbesitzer sensibilisiert, ihre Haie und Katzen für Notfälle vorzubereiten.",true,"{""day"": 15, ""month"": 7}",US,2026-01-15 08:51:02.570015+01
83b599f3-4218-4ddd-add9-3dd455ade98c,Gedenktag des Heiligen Bonaventura,"Bedeutender Theologe, Philosoph und Kirchenlehrer des Franziskanerordens.",true,"{""day"": 15, ""month"": 7}",INT,2026-01-15 08:51:02.570015+01
f4587800-37bf-48ce-a7e0-ab64aa99a588,Swithun-Tag,Ein englischer Lostag; das Wetter an diesem Tag soll (ähnlich wie beim Siebenschläfer) 40 Tage lang anhalten.,true,"{""day"": 15, ""month"": 7}",UK,2026-01-15 08:51:02.570015+01
1c167223-919e-489f-9b90-84557e6cecb9,Welt-Schlangentag,Ein Aktionstag zur Aufklärung über die ökologische Bedeutung von Schlangen und zum Abbau von Vorurteilen gegenüber diesen Reptilien.,true,"{""day"": 16, ""month"": 7}",INT,2026-01-15 08:51:02.570015+01
19fa7e7c-bc6d-42a8-8f6a-5ac2ca4b45f7,Start-von-Apollo-11-Tag,Erinnert an den Start der legendären Mondmission im Jahr 1969 vom Kennedy Space Center.,true,"{""day"": 16, ""month"": 7}",INT,2026-01-15 08:51:02.570015+01
3aee2331-aa01-404d-bbd0-693b166b3151,Tag der Corned Beef-Pastete,National Corned Beef Hash Day – Ein kulinarischer Gedenktag für das traditionelle Frühstücksgericht.,true,"{""day"": 16, ""month"": 7}",US,2026-01-15 08:51:02.570015+01
916a5c7f-682e-41f4-a1fe-01550f6cc965,Tag des persönlichen Wohlbefindens,"Personal Chef Day – Würdigt die Arbeit von Privatköchen und betont die Bedeutung einer gesunden, individuell zubereiteten Ernährung.",true,"{""day"": 16, ""month"": 7}",INT,2026-01-15 08:51:02.570015+01
00783391-39a3-47e5-a376-3ed4fa9fa0d3,Gedenktag Unserer Lieben Frau auf dem Berge Karmel,Das Patronatsfest des Karmelitenordens und ein bedeutender Mariengedenktag.,true,"{""day"": 16, ""month"": 7}",INT,2026-01-15 08:51:02.570015+01
f7e376b4-1cfa-4a97-9dab-6c85b018502c,Tag der Befreiung (La Paz),Ein wichtiger regionaler Feiertag in Bolivien zur Erinnerung an den Aufstand von 1809.,true,"{""day"": 16, ""month"": 7}",BO,2026-01-15 08:51:02.570015+01
f5e930af-59fe-441c-827f-1d6c6a38f167,Meerschweinchen-Tag,Guinea Pig Appreciation Day – Ein Ehrentag für die beliebten kleinen Nagetiere.,true,"{""day"": 16, ""month"": 7}",INT,2026-01-15 08:51:02.570015+01
d2714b2a-bcf6-4e96-9756-e6e66f262e38,World Emoji Day,Ein globaler Feiertag zur Feier der digitalen Symbole; das Datum bezieht sich auf das Kalender-Emoji in iOS.,true,"{""day"": 17, ""month"": 7}",INT,2026-01-15 08:51:02.570015+01
d23bc56d-c231-4ea2-9e53-39c5fde6b9f1,Tag der internationalen Strafjustiz,"Erinnert an die Annahme des Römischen Statuts 1998, der Grundlage für den Internationalen Strafgerichtshof.",true,"{""day"": 17, ""month"": 7}",INT,2026-01-15 08:51:02.570015+01
7662cd0f-9974-4f6b-b26e-4a5acc111a06,Gelbe-Schweine-Tag,"Yellow Pig Day – Ein humorvoller Tag, der in den 1960ern von Mathematikstudenten zu Ehren der Zahl 17 ins Leben gerufen wurde.",true,"{""day"": 17, ""month"": 7}",INT,2026-01-15 08:51:02.570015+01
be0e4b3b-c507-40b0-8a89-1d8fde698efb,Tag des Pfirsicheises,"National Peach Ice Cream Day – Ein kulinarischer Gedenktag, der die sommerliche Ernte der Pfirsiche feiert.",true,"{""day"": 17, ""month"": 7}",US,2026-01-15 08:51:02.570015+01
a1949136-c25d-4abd-b08e-72ec82ac2ad4,Tag des Tattoos,National Tattoo Day – Ein Tag zur Wertschätzung der Körperkunst und der Geschichte des Tätowierens.,true,"{""day"": 17, ""month"": 7}",INT,2026-01-15 08:51:02.570015+01
f9bce405-00c7-4b1a-ac71-2897c4566cb3,Verfassungstag (Südkorea),Gedenktag an die Verkündung der südkoreanischen Verfassung im Jahr 1948.,true,"{""day"": 17, ""month"": 7}",KR,2026-01-15 08:51:02.570015+01
710d330d-67a3-41d5-ad66-89f78f737be5,Gedenktag der seligen Karmelitinnen von Compiègne,"Erinnert an die 16 Nonnen, die während der Französischen Revolution hingerichtet wurden.",true,"{""day"": 17, ""month"": 7}",FR,2026-01-15 08:51:02.570015+01
ec34db59-564d-4484-b0b1-53b20cb3493a,Nelson-Mandela-Tag,"Internationaler UN-Gedenktag zur Feier von Mandelas Geburtstag und seinem Einsatz für Frieden, Versöhnung und Menschenrechte.",true,"{""day"": 18, ""month"": 7}",INT,2026-01-15 08:51:02.570015+01
a50c1b6b-de3d-4b15-bd73-35c9c1d57a12,Welttag des Zuhörens,World Listening Day – rückt die Bedeutung des bewussten Zuhörens und der akustischen Ökologie in den Mittelpunkt.,true,"{""day"": 18, ""month"": 7}",INT,2026-01-15 08:51:02.570015+01
435e29c9-9183-4a6e-9c03-579cebf95aeb,Tag der Kaviar-Liebhaber,National Caviar Day – Ein kulinarischer Gedenktag zu Ehren der edlen Delikatesse.,true,"{""day"": 18, ""month"": 7}",INT,2026-01-15 08:51:02.570015+01
5e83e030-9631-46ac-9cb7-6b70035cf3ba,Tag des Sour Candy (Saure Süßigkeiten),"National Sour Candy Day – Ein Tag für alle, die es bei Süßwaren gerne säuerlich und prickelnd mögen.",true,"{""day"": 18, ""month"": 7}",US,2026-01-15 08:51:02.570015+01
fa67cd3e-5082-496a-959e-a59ee23c0e5e,Versicherungstag,National Insurance Day – Ein praktischer Tag zur Überprüfung der eigenen Vorsorge und Absicherung.,true,"{""day"": 18, ""month"": 7}",INT,2026-01-15 08:51:02.570015+01
53a73e55-0536-4a83-8f98-dad3053277b8,Gedenktag des Heiligen Arnulf von Metz,Schutzpatron der Brauer und Namensgeber für das Arnulf-Fest; ein bedeutender fränkischer Bischof.,true,"{""day"": 18, ""month"": 7}",FR/DE,2026-01-15 08:51:02.570015+01
e05a9463-8b28-43ae-bb71-ad30762ebf2c,Tag der Verfassung (Uruguay),Jura de la Constitución – Gedenktag an die feierliche Vereidigung der ersten Verfassung im Jahr 1830.,true,"{""day"": 18, ""month"": 7}",UY,2026-01-15 08:51:02.570015+01
6fafe37b-172f-43ed-bddf-56aab0730c28,Tag des Müßiggangs,"World Sauntering Day – Ein Tag, der dazu einlädt, das Tempo zu drosseln, gemütlich zu schlendern und das Leben ohne Eile zu genießen.",true,"{""day"": 19, ""month"": 7}",INT,2026-01-15 08:51:02.570015+01
a23fef17-b456-41b0-a531-58e5e8c1bea7,Tag der Daiquiri-Liebhaber,"National Daiquiri Day – Ein kulinarischer Ehrentag für den klassischen kubanischen Cocktail aus Rum, Limette und Zucker.",true,"{""day"": 19, ""month"": 7}",INT,2026-01-15 08:51:02.570015+01
94a9e238-e6c0-4558-b3db-fb5fc948f66d,Seneca Falls Gedenktag,"Erinnert an den Beginn der ersten Frauenrechtskonvention (Seneca Falls Convention) im Jahr 1848, einem Meilenstein des Feminismus.",true,"{""day"": 19, ""month"": 7}",US,2026-01-15 08:51:02.570015+01
489e87a8-6db0-4e25-ad38-fd7396867abd,Tag der Garfield-Comics (Ersatztermin),"Mancherorts gefeiert, um den berühmten fetten, orangen Kater und seine Abneigung gegen Montage zu ehren.",true,"{""day"": 19, ""month"": 7}",INT,2026-01-15 08:51:02.570015+01
b8a21139-523c-4fd4-8eea-398af65bebec,Tag der Unabhängigkeit (Laos),Gedenktag zur Erlangung der Unabhängigkeit von Frankreich im Jahr 1949.,true,"{""day"": 19, ""month"": 7}",LA,2026-01-15 08:51:02.570015+01
ec60dc9a-390c-487e-9628-476621cb5198,Tag der Zungenbrecher,International Tongue Twister Day (Sommer-Termin) – Ein spielerischer Tag für linguistische Herausforderungen.,true,"{""day"": 19, ""month"": 7}",INT,2026-01-15 08:51:02.570015+01
80294011-8abc-4c9a-9939-4b37bd8b38a8,Gedenktag der Heiligen Makrina die Jüngere,"Die ""Lehrerin"" und Schwester von Basilius dem Großen, hochverehrt in der orthodoxen und katholischen Kirche.",true,"{""day"": 19, ""month"": 7}",INT,2026-01-15 08:51:02.570015+01
d553caf6-29a8-466b-8bf2-f61177c32e47,Tag der Märtyrer (Myanmar),"Ein bedeutender nationaler Gedenktag zu Ehren von Aung San und weiteren Mitgliedern der Übergangsregierung, die 1947 ermordet wurden.",true,"{""day"": 19, ""month"": 7}",MM,2026-01-15 08:51:02.570015+01
12aa7c69-6333-4d68-9594-e96489b26d2e,Internationaler Weltschachtag,Gedenktag zur Gründung des Weltschachverbandes FIDE im Jahr 1924; feiert das Schachspiel als Symbol für Strategie und Logik.,true,"{""day"": 20, ""month"": 7}",INT,2026-01-15 08:51:02.570015+01
a5609cec-9ca6-4949-9919-8fb16d7c758f,Weltraumtag (Tag der Mondlandung),Erinnert an die erste bemannte Mondlandung durch Apollo 11 im Jahr 1969 und die berühmten Worte von Neil Armstrong.,true,"{""day"": 20, ""month"": 7}",INT,2026-01-15 08:51:02.570015+01
9cd65ea5-0740-49fd-8ccf-59d3c34c3671,Gedenktag zum 20. Juli 1944,Erinnert an das versuchte Attentat von Claus Schenk Graf von Stauffenberg auf Adolf Hitler und den Widerstand gegen den Nationalsozialismus.,true,"{""day"": 20, ""month"": 7}",DE,2026-01-15 08:51:02.570015+01
13be3832-aa70-4003-858e-ac2cb6256d6a,Welt-Lollipop-Tag,National Lollipop Day – Ein kulinarischer Gedenktag zu Ehren der bunten Dauerlutscher.,true,"{""day"": 20, ""month"": 7}",INT,2026-01-15 08:51:02.570015+01
c7af38d9-28c7-4986-80bb-84bde9c8971d,Tag der Unabhängigkeit (Kolumbien),Nationalfeiertag zur Erinnerung an die Unabhängigkeitserklärung von Spanien im Jahr 1810.,true,"{""day"": 20, ""month"": 7}",CO,2026-01-15 08:51:02.570015+01
8f231980-351c-4638-9381-7ce9083af594,Tag des Glückskekses,National Fortune Cookie Day – Ein Tag zur Feier der knusprigen Kekse mit den verborgenen Botschaften.,true,"{""day"": 20, ""month"": 7}",INT,2026-01-15 08:51:02.570015+01
108c810e-8e42-45d8-8224-5383c2e4a591,Tag der hässlichen LKW,"Ugly Truck Day – Ein kurioser Gedenktag, der die Zuverlässigkeit alter, verbeulter Lastkraftwagen feiert.",true,"{""day"": 20, ""month"": 7}",INT,2026-01-15 08:51:02.570015+01
277491e6-b7b8-4718-87ec-e92230c98fa9,Gedenktag des Propheten Elija,"Ein bedeutender biblischer Prophet, der in der jüdischen, christlichen und islamischen Tradition verehrt wird.",true,"{""day"": 20, ""month"": 7}",INT,2026-01-15 08:51:02.570015+01
5ee65bb3-1d38-4241-b7fa-23b7bb83f729,Nationaler Gedenktag für verstorbene Drogenabhängige,Ein Tag des Erinnerns an die Opfer von Drogensucht und zur Forderung einer humaneren Drogenpolitik.,true,"{""day"": 21, ""month"": 7}",DE,2026-01-15 08:51:02.570015+01
248960fb-efbd-47c7-89d1-26bf4f7be8ee,Nationalfeiertag Belgien,"Erinnert an den Amtseid von Leopold I. im Jahr 1831, dem ersten König der Belgier.",true,"{""day"": 21, ""month"": 7}",BE,2026-01-15 08:51:02.570015+01
2ff2c7c3-1a11-4ffa-be16-75e918a499aa,Tag des Junkfoods,"National Junk Food Day – Ein Tag, an dem man sich bewusst und ohne schlechtes Gewissen seinen liebsten ungesunden Snacks widmen darf.",true,"{""day"": 21, ""month"": 7}",INT,2026-01-15 08:51:02.570015+01
e8677e93-e071-4392-b770-cf8f0ae9453f,Lerne-deine-Insel-kennen-Tag,Local Island Awareness Day – Ein Aktionstag zur Förderung des Tourismus und Schutzes lokaler Inselökosysteme.,true,"{""day"": 21, ""month"": 7}",INT,2026-01-15 08:51:02.570015+01
96aa4c7a-77f9-4700-9746-4efc385e6fe4,Gedenktag zur Befreiung (Guam),Liberation Day – Erinnert an die Befreiung der Insel von der japanischen Besatzung im Jahr 1944.,true,"{""day"": 21, ""month"": 7}",GU,2026-01-15 08:51:02.570015+01
e26cdea0-54e6-4529-8b76-1575ab55e01e,Tag der Unabhängigkeit (Belgien),Zusätzlicher Aspekt des belgischen Nationalfeiertags zur Feier der staatlichen Souveränität.,true,"{""day"": 21, ""month"": 7}",BE,2026-01-15 08:51:02.570015+01
73b6f55a-d5f3-4567-96ba-aa91a44c0672,Gedenktag des Heiligen Laurentius von Brindisi,"Kirchenlehrer und Kapuzinerpater, bekannt für sein diplomatisches Geschick im 16. Jahrhundert.",true,"{""day"": 21, ""month"": 7}",INT,2026-01-15 08:51:02.570015+01
e893dabd-e1fa-458e-99f3-c6ed15fa3d46,Welthirntag,World Brain Day – Eine Initiative der World Federation of Neurology zur Aufklärung über Hirngesundheit und Prävention.,true,"{""day"": 22, ""month"": 7}",INT,2026-01-15 08:51:02.570015+01
90614593-d6d4-474f-b672-5c908decd911,Tag der Hängematte,"Hammock Day – Ein inoffizieller Feiertag, der dazu aufruft, die Seele baumeln zu lassen und im Freien zu entspannen.",true,"{""day"": 22, ""month"": 7}",INT,2026-01-15 08:51:02.570015+01
1b0b3497-1d80-466a-b3f2-68f8a1f66d5f,Pi-Annäherungstag,"Gedenktag für die Kreiszahl Pi, da der Bruch 22/7 eine mathematische Annäherung an den Wert von Pi darstellt.",true,"{""day"": 22, ""month"": 7}",INT,2026-01-15 08:51:02.570015+01
a9421aa5-00f2-4d9b-9005-d69de60c87fd,Gedenktag der Heiligen Maria Magdalena,Festtag der „Apostelin der Apostel“; seit 2016 im römischen Generalkalender den Apostelfesten gleichgestellt.,true,"{""day"": 22, ""month"": 7}",INT,2026-01-15 08:51:02.570015+01
bc162719-a9eb-4d9e-b021-8d0b464a2a62,Tag der Ratte,"Ratcatcher’s Day – Erinnert an die Sage des Rattenfängers von Hameln, der laut Überlieferung am 22. Juli 1284 die Kinder entführte.",true,"{""day"": 22, ""month"": 7}",DE,2026-01-15 08:51:02.570015+01
b61ec339-c541-427b-88ee-601024b95670,Tag des Penuche-Fudge,National Penuche Fudge Day – Ein kulinarischer Gedenktag für die aus braunem Zucker hergestellte Karamell-Süßware.,true,"{""day"": 22, ""month"": 7}",US,2026-01-15 08:51:02.570015+01
4222c7a5-c73a-4aaa-a0d5-9268e5a417e6,Tag der Verfassung (Aserbaidschan),Nationalfeiertag zu Ehren der nationalen Presse und Information.,true,"{""day"": 22, ""month"": 7}",AZ,2026-01-15 08:51:02.570015+01
e4a1114b-8c8f-435d-bc78-69a37a2d5f8d,Tag des Hot Dogs,"National Hot Dog Day – Ein kulinarischer Ehrentag für den Klassiker im Brötchen, der besonders im Sommer zelebriert wird.",true,"{""day"": 23, ""month"": 7}",INT,2026-01-15 08:51:02.570015+01
62c46230-e982-43da-a42f-6b56cc849867,Sprich-wie-ein-Seemann-Tag,International Talk Like a Pirate Day (Ersatztermin/Abwandlung) – Ein humorvoller Tag für nautischen Slang und Seemannsgarn.,true,"{""day"": 23, ""month"": 7}",INT,2026-01-15 08:51:02.570015+01
a8599584-0dc3-4ed4-9ab6-1cc810daa776,Tag der Revolution (Ägypten),Nationalfeiertag zur Erinnerung an die Revolution von 1952 und die Ausrufung der Republik.,true,"{""day"": 23, ""month"": 7}",EG,2026-01-15 08:51:02.570015+01
0e23435c-82bb-4b8e-840f-161c58be713c,Tag der Renaissance (Oman),Renaissance Day – Feiert den Thronantritt von Sultan Qabus im Jahr 1970 und den Beginn der Modernisierung des Landes.,true,"{""day"": 23, ""month"": 7}",OM,2026-01-15 08:51:02.570015+01
7b7e1ae9-bae0-4673-9d27-c3ade8d3ae22,Vanilleeis-Tag,National Vanilla Ice Cream Day – Ein Gedenktag für die weltweit beliebteste Eissorte.,true,"{""day"": 23, ""month"": 7}",INT,2026-01-15 08:51:02.570015+01
58dce170-ed08-410d-81b1-1f7f53154a99,Tag des Zeichentrickfilms (Ersatztermin),"Mancherorts gefeiert, um die Kunst der Animation und klassische Cartoons zu würdigen.",true,"{""day"": 23, ""month"": 7}",INT,2026-01-15 08:51:02.570015+01
8c542e20-a466-4d4c-8b8d-460dc077d7cf,Gedenktag der Heiligen Birgitta von Schweden,Patronin Europas und Ordensgründerin der Erlöserorden (Birgittinnen).,true,"{""day"": 23, ""month"": 7}",EU,2026-01-15 08:51:02.570015+01
9d5dd7c3-6365-45ea-9d42-d52bb9fcd846,Tag der Freude,"International Day of Joy – Ein Tag, um das Glück im Alltag zu suchen und positive Energie mit Mitmenschen zu teilen.",true,"{""day"": 24, ""month"": 7}",INT,2026-01-15 08:51:02.570015+01
a17665c1-9e87-458b-b05a-11c63167face,Tag der Cousins und Cousinen,National Cousins Day – Ein Ehrentag für die oft ersten Freunde im Leben innerhalb der erweiterten Familie.,true,"{""day"": 24, ""month"": 7}",INT,2026-01-15 08:51:02.570015+01
ad8dc3ee-3b39-4453-9350-0dc71276eae3,Pionier-Tag (Utah),Pioneer Day – Gedenktag an den Einzug von Brigham Young und den mormonischen Pionieren ins Salt Lake Valley 1847.,true,"{""day"": 24, ""month"": 7}",US-UT,2026-01-15 08:51:02.570015+01
9d4d33f1-80ff-49aa-9fcf-4f82441669c8,Tag des Tequila,National Tequila Day – Ein kulinarischer Gedenktag zu Ehren der mexikanischen Agaven-Spirituose.,true,"{""day"": 24, ""month"": 7}",INT,2026-01-15 08:51:02.570015+01
6f9afac0-f4c3-4381-af8b-dd66cee00d83,Tag der Autoverwertung,"Ein Aktionstag, der auf die Bedeutung von Recycling und nachhaltiger Ressourcenrückgewinnung in der Automobilindustrie aufmerksam macht.",true,"{""day"": 24, ""month"": 7}",INT,2026-01-15 08:51:02.570015+01
4e77ec19-1d86-4090-9b23-802f3f62d2bd,Gedenktag der Heiligen Christina von Bolsena,"Frühchristliche Märtyrerin und Schutzpatronin der Müller, Bogenschützen und Seeleute.",true,"{""day"": 24, ""month"": 7}",INT,2026-01-15 08:51:02.570015+01
f3828a60-1c3f-46d1-a215-c4a855844d43,Simon-Bolivar-Tag,"Gedenktag an den Geburtstag des ""Libertador"" Simón Bolívar, der die Unabhängigkeit vieler südamerikanischer Staaten anführte.",true,"{""day"": 24, ""month"": 7}",VE/CO/EC,2026-01-15 08:51:02.570015+01
9314ef91-88d1-4044-b5b7-51a3bee67d74,Fahre-mit-deinem-Oldtimer-zur-Arbeit-Tag,Drive Your Antique Car to Work Day – Ein Tag zur Präsentation von historischen Fahrzeugen im Alltag.,true,"{""day"": 24, ""month"": 7}",INT,2026-01-15 08:51:02.570015+01
43c21700-42bb-4c8e-af1d-79df75f68388,Welttag der Prävention gegen Ertrinken,"Ein von der WHO koordinierter Tag, um auf Ertrinken als vermeidbare Todesursache aufmerksam zu machen.",true,"{""day"": 25, ""month"": 7}",INT,2026-01-15 08:51:02.570015+01
764eed2c-7859-42b0-9de1-31d04b146905,Jakobustag (St. James Day),"Gedenktag des Apostels Jakobus des Älteren, Schutzpatron der Pilger; wichtigster Tag für den Jakobsweg.",true,"{""day"": 25, ""month"": 7}",INT,2026-01-15 08:51:02.570015+01
