id,name,description,is_fixed,rule,country,created_at
039255f4-ba62-4c56-a7d3-9c851cd64e4f,Astronomischer Herbstanfang (Tag-und-Nacht-Gleiche),"Zeitpunkt, an dem die Sonne den Äquator nach Süden überschreitet; Tag und Nacht sind etwa gleich lang.",false,"{""rule"": ""astronomical_equinox_autumn""}",INT,2026-01-15 11:48:20.332673+01
4df64b29-7e28-4b44-9cd9-c0e9361ff7c9,Welttag des Nashorns,World Rhino Day – Eine Initiative des WWF zum Schutz der fünf verbleibenden Nashornarten vor Wilderei und Lebensraumverlust.,true,"{""day"": 22, ""month"": 9}",INT,2026-01-15 11:48:20.332673+01
58cbd527-3f77-4037-9266-d26d7a4224a7,Welttag der Flüsse,"World Rivers Day – Ein Aktionstag (oft am 4. Sonntag im September), der die Bedeutung und den Schutz unserer Fließgewässer feiert.",false,"{""month"": 9, ""occurrence"": 4, ""day_of_week"": ""Sunday""}",INT,2026-01-15 11:48:20.332673+01
915c72fa-72d9-4aaf-b7de-c641b199ab07,Tag der Unabhängigkeit (Bulgarien),Nationalfeiertag zur Erinnerung an die endgültige Loslösung vom Osmanischen Reich im Jahr 1908.,true,"{""day"": 22, ""month"": 9}",BG,2026-01-15 11:48:20.332673+01
57fd1d6a-f4df-4f7f-a673-30ef605ac04d,Tag der Unabhängigkeit (Mali),Gedenktag an die Erlangung der Unabhängigkeit von Frankreich im Jahr 1960.,true,"{""day"": 22, ""month"": 9}",ML,2026-01-15 11:48:20.332673+01
8474b560-ef14-4e95-aeca-7e44c49d75cc,Hobbit-Tag,Inoffizieller Fantag zu Ehren der Geburtstage von Bilbo und Frodo Beutlin aus J.R.R. Tolkiens „Der Herr der Ringe“.,true,"{""day"": 22, ""month"": 9}",INT,2026-01-15 11:48:20.332673+01
43841437-346b-44fd-a7c0-aed2ec262e13,Gedenktag des Heiligen Mauritius,"Anführer der Thebäischen Legion und Schutzpatron der Soldaten, Handwerker und der Stadt Magdeburg.",true,"{""day"": 22, ""month"": 9}",INT,2026-01-15 11:48:20.332673+01
1e82ca36-9a0a-4c3b-a26b-bb723b4710e5,Internationaler Tag der Gebärdensprachen,Ein von der UN ausgerufener Tag zur Würdigung der Gebärdensprachen als vollwertige Sprachen und zur Förderung der Rechte Gehörloser.,true,"{""day"": 23, ""month"": 9}",INT,2026-01-15 11:48:20.332673+01
54ad5336-0cce-4a22-bc07-c5323e7ae5c9,Biskuittag der Nationalspeise,National Snack a Pretzel Day (oft am 22.9.) – Ein kulinarischer Gedenktag zu Ehren der Brezel in den USA.,true,"{""day"": 23, ""month"": 9}",US,2026-01-15 11:48:20.332673+01
ac2bb0b7-1f28-44ce-a91e-fa1392c4f248,Internationaler Tag der Bisexualität,Celebrate Bisexuality Day – Ein Aktionstag zur Sichtbarkeit von bisexuellen Menschen und zum Abbau von Vorurteilen.,true,"{""day"": 23, ""month"": 9}",INT,2026-01-15 11:48:20.332673+01
77e185e2-8004-4e4e-9fa6-b70934efd8aa,Beginn des Sternzeichens Waage,Astronomischer Übergang der Sonne in das Tierkreiszeichen Waage (Datum kann je nach Jahr leicht variieren).,true,"{""day"": 23, ""month"": 9}",INT,2026-01-15 11:48:20.332673+01
b357d40e-ddce-4636-8f7d-987db1fb1927,Nationalfeiertag Saudi-Arabien,Gedenktag an die Vereinigung der Königreiche Nadschd und Hidschas zum Königreich Saudi-Arabien im Jahr 1932.,true,"{""day"": 23, ""month"": 9}",SA,2026-01-15 11:48:20.332673+01
9bac4e17-2651-4327-aae5-187f81219e47,Tag der Verfassung (Japan),Arbeitnehmer-Feiertag Keirō no Hi (oft am 3. Montag im Sept.) – Gedenktag an die Verfassung.,false,"{""month"": 9, ""occurrence"": 3, ""day_of_week"": ""Monday""}",JP,2026-01-15 11:48:20.332673+01
56c39508-7c63-4e3d-a659-777aa865a9b5,Gedenktag des Heiligen Padre Pio,"Heiliger Priester und Kapuzinermönch, bekannt für seine Stigmata und Wunderheilungen im 20. Jahrhundert.",true,"{""day"": 23, ""month"": 9}",INT,2026-01-15 11:48:20.332673+01
a8239637-aad5-460e-9844-84af672d616a,Tag des Kaugummis,National Chew gum day – Ein kurioser Gedenktag zu Ehren des beliebten Kaumaterials.,true,"{""day"": 23, ""month"": 9}",INT,2026-01-15 11:48:20.332673+01
7631a4a2-0220-42f0-9f84-c76591c38ef6,Tag der Herzgesundheit (Ersatztermin),"Oft im Vorfeld des Weltherztages genutzt, um über Prävention von Herz-Kreislauf-Erkrankungen aufzuklären.",true,"{""day"": 24, ""month"": 9}",INT,2026-01-15 11:48:20.332673+01
b3df4ffe-653f-43ec-9a2f-5d309a821ee3,Heritage Day (Erbe-Tag),"Nationalfeiertag in Südafrika, an dem die Vielfalt der Kulturen, Bräuche und Traditionen des Landes gefeiert wird (auch als Braai Day bekannt).",true,"{""day"": 24, ""month"": 9}",ZA,2026-01-15 11:48:20.332673+01
ff774dfc-db15-4f34-abf1-248c3a960cc3,Tag der Interpunktion,National Punctuation Day – Ein Tag zur Feier der korrekten Grammatik und Zeichensetzung.,true,"{""day"": 24, ""month"": 9}",US,2026-01-15 11:48:20.332673+01
c76a3cbd-2cf4-4a82-ab9a-faa1259925f9,Tag der Unabhängigkeit (Guinea-Bissau),Nationalfeiertag zur Erinnerung an die einseitige Unabhängigkeitserklärung von Portugal im Jahr 1973.,true,"{""day"": 24, ""month"": 9}",GW,2026-01-15 11:48:20.332673+01
dafeb9b2-2585-42ef-8097-82db8d1cc06c,Welttag der Seeleute (Ersatztermin),Häufiger Ausweichtermin für maritime Gedenktage zur Anerkennung der Arbeit auf hoher See.,true,"{""day"": 24, ""month"": 9}",INT,2026-01-15 11:48:20.332673+01
f83d6abb-dd5f-455e-8592-a6797a532f19,Cherries-Jubilee-Tag,National Cherries Jubilee Day – Ein kulinarischer Gedenktag zu Ehren der flambierten Kirschspeise.,true,"{""day"": 24, ""month"": 9}",INT,2026-01-15 11:48:20.332673+01
56cb503e-68e3-46be-921c-446a8b24d095,Gedenktag des Heiligen Rupert von Salzburg,Apostel der Bayern und Gründer des Klosters St. Peter in Salzburg; Patron des Landes Salzburg (Rupertikirtag).,true,"{""day"": 24, ""month"": 9}",AT/DE,2026-01-15 11:48:20.332673+01
7d3e9728-2f5a-418c-b2ee-92d9454a6215,Tag der Zahngesundheit,Ein nationaler Aktionstag in Deutschland zur Aufklärung über Mundhygiene und die Vorbeugung von Zahn- und Mundkrankheiten.,true,"{""day"": 25, ""month"": 9}",DE,2026-01-15 11:48:20.332673+01
1e0dcb32-c3a9-41e5-bc7d-e988049f00cf,Welttag der Apotheker,"World Pharmacists Day – Ein von der FIP ins Leben gerufener Tag, um die Rolle der Apotheker für die globale Gesundheit zu würdigen.",true,"{""day"": 25, ""month"": 9}",INT,2026-01-15 11:48:20.332673+01
4ea149c0-435d-47ed-aa63-30713f7537e0,Tag der Träume,"World Dream Day – Ein Aktionstag, der dazu inspiriert, eigene Ideen und Visionen zu verfolgen und die Welt positiv zu verändern.",true,"{""day"": 25, ""month"": 9}",INT,2026-01-15 11:48:20.332673+01
04c85a25-06c6-463b-8a05-9bcf7fe95c2b,Comic-Hefte-Tag,"National Comic Book Day – Ein Tag für Sammler und Fans, um die Kunstform des Comics und seine Helden zu feiern.",true,"{""day"": 25, ""month"": 9}",INT,2026-01-15 11:48:20.332673+01
2e5893a7-5357-401f-8cbf-5cc385c749af,Gedenktag des Heiligen Nikolaus von Flüe,"Nationalheiliger der Schweiz (Bruder Klaus); Friedensstifter und Einsiedler, der im 15. Jahrhundert wirkte.",true,"{""day"": 25, ""month"": 9}",CH,2026-01-15 11:48:20.332673+01
f051f4ba-6f91-43e6-a2c1-704a270b9d0d,Tag der Hummer-Liebhaber,"National Lobster Day – Ein kulinarischer Gedenktag, der die Edel-Krustentiere in den Mittelpunkt stellt.",true,"{""day"": 25, ""month"": 9}",US,2026-01-15 11:48:20.332673+01
5e39f10f-0fa6-4cee-98a2-9b7d2075022a,One-Hit-Wonder-Tag,"National One-Hit Wonder Day – Erinnert an Musiker und Bands, die mit nur einem einzigen großen Hit Weltruhm erlangten.",true,"{""day"": 25, ""month"": 9}",INT,2026-01-15 11:48:20.332673+01
d3de3a23-65d1-4ee7-82b1-540a1f44b6ef,Europäischer Tag der Sprachen,Eine Initiative des Europarats zur Förderung der Mehrsprachigkeit und zum Erlernen von Fremdsprachen in ganz Europa.,true,"{""day"": 26, ""month"": 9}",EU,2026-01-15 11:48:20.332673+01
10ed5101-3e51-4064-9dcb-4b42570f882a,Welttag der Verhütung,World Contraception Day – Ein Aktionstag zur Verbesserung des Bewusstseins für Empfängnisverhütung und sexuelle Gesundheit.,true,"{""day"": 26, ""month"": 9}",INT,2026-01-15 11:48:20.332673+01
686786be-a612-4f6c-bcf5-306805a07e27,Welttag der Umwelthungerhilfe,World Environmental Health Day – Macht auf die Auswirkungen der Umwelt auf die menschliche Gesundheit aufmerksam.,true,"{""day"": 26, ""month"": 9}",INT,2026-01-15 11:48:20.332673+01
104fca28-d993-41a3-b7fd-0225f76e5306,Internationaler Tag für die vollständige Beseitigung von Kernwaffen,Ein von der UN ausgerufener Gedenktag zur Förderung der globalen nuklearen Abrüstung.,true,"{""day"": 26, ""month"": 9}",INT,2026-01-15 11:48:20.332673+01
37180640-c62e-47a8-8086-c006e64fb9e7,Tag der Liebesbriefe,"Love Note Day – Ein Tag, der dazu einlädt, handgeschriebene Botschaften der Zuneigung an geliebte Menschen zu verfassen.",true,"{""day"": 26, ""month"": 9}",INT,2026-01-15 11:48:20.332673+01
14adb483-fc53-4532-b4ff-4c4cea04b710,Tag der Pfannkuchen (Ersatztermin),National Pancake Day – In einigen Regionen ein kulinarischer Feiertag zu Ehren der Eierkuchen.,true,"{""day"": 26, ""month"": 9}",US,2026-01-15 11:48:20.332673+01
b60c3714-3059-4521-b617-5c75cae94697,Gedenktag der Heiligen Kosmas und Damian,"Zwillingsbrüder und Ärzte, die als unentgeltlich heilende Patrone der Mediziner und Apotheker verehrt werden.",true,"{""day"": 26, ""month"": 9}",INT,2026-01-15 11:48:20.332673+01
a3a99875-69d2-4edd-b138-36d3f33f22f2,Welttag des Tourismus,"Ein von der UNWTO ausgerufener Tag, um die Bedeutung des Tourismus für die internationale Gemeinschaft und Wirtschaft zu würdigen.",true,"{""day"": 27, ""month"": 9}",INT,2026-01-15 11:48:20.332673+01
536c5890-e8e6-481e-a407-84478cedb2f4,Jahrestag des Luxemburger Abkommens,Erinnert an das 1952 unterzeichnete Wiedergutmachungsabkommen zwischen der Bundesrepublik Deutschland und Israel.,true,"{""day"": 27, ""month"": 9}",DE/IL,2026-01-15 11:48:20.332673+01
a05e1546-7d70-454c-869f-5ee1d4aef817,Tag der Ahnen (Ancestors Day),Ein inoffizieller Tag zur Erforschung der eigenen Familiengeschichte und zur Würdigung der Vorfahren.,true,"{""day"": 27, ""month"": 9}",INT,2026-01-15 11:48:20.332673+01
874c4709-7316-474d-a4aa-6ff0c28f5860,Tag des Schokomilch-Shakes (Ersatztermin),"Oft parallel zum 12.09. gefeiert, um die süße Erfrischung im Spätsommer zu genießen.",true,"{""day"": 27, ""month"": 9}",US,2026-01-15 11:48:20.332673+01
585b1d2d-bdca-41be-af3c-2841640d120f,Tag des Corned Beef,National Corned Beef Hash Day (Ersatztermin) – Ein kulinarischer Gedenktag für das traditionelle Fleischgericht.,true,"{""day"": 27, ""month"": 9}",INT,2026-01-15 11:48:20.332673+01
a93b38bc-73fa-4204-aafd-0cdac93acbf3,Gedenktag des Heiligen Vinzenz von Paul,Begründer der neuzeitlichen Caritas und Schutzpatron aller caritativen Vereine und Werke.,true,"{""day"": 27, ""month"": 9}",INT,2026-01-15 11:48:20.332673+01
e4233563-8f5a-47ec-9298-920b73309948,Welttag der Tollwut,World Rabies Day – Erinnert an den Todestag von Louis Pasteur und sensibilisiert für die Prävention dieser tödlichen Zoonose.,true,"{""day"": 28, ""month"": 9}",INT,2026-01-15 11:48:20.332673+01
056928b9-3691-4d80-a2ff-9fa8f4c17c00,Internationaler Tag des allgemeinen Zugangs zu Informationen,"Ein von der UNESCO ausgerufener Tag, der das Recht auf Information als Grundpfeiler von Demokratie und Entwicklung betont.",true,"{""day"": 28, ""month"": 9}",INT,2026-01-15 11:48:20.332673+01
97497739-b757-4aae-a5a9-85242bef19a4,Tag der Unabhängigkeit (Tschechien),"Tag der tschechischen Staatlichkeit – Gedenktag an den heiligen Wenzel (Wenzels-Tag), den Landespatron.",true,"{""day"": 28, ""month"": 9}",CZ,2026-01-15 11:48:20.332673+01
0bc5106f-e85c-4f55-ad62-be7c2123406b,Weltherztag (2025/2026),Häufiger Termin (offiziell oft 29.09.) für Kampagnen zur Herzgesundheit und Prävention von Herz-Kreislauf-Erkrankungen.,true,"{""day"": 28, ""month"": 9}",INT,2026-01-15 11:48:20.332673+01
b22c0215-0a18-4c8c-8ed0-9700c934438c,Tag des Erdbeerkuchens,National Strawberry Cream Pie Day (Ersatztermin) – Ein kulinarischer Gedenktag für die fruchtige Süßspeise.,true,"{""day"": 28, ""month"": 9}",US,2026-01-15 11:48:20.332673+01
36e60135-6fa0-4ac5-84bc-13323906b2a1,Tag der Trinkhalme,National Drink a Beer Day – Ein inoffizieller Tag der Geselligkeit (oft in den USA zelebriert).,true,"{""day"": 28, ""month"": 9}",INT,2026-01-15 11:48:20.332673+01
32c56029-b119-40de-8c27-176b0d93d518,Gedenktag des Heiligen Wenzel,Märtyrer und Herzog von Böhmen; Nationalheiliger der Tschechen und Patron der Brauer.,true,"{""day"": 28, ""month"": 9}",INT,2026-01-15 11:48:20.332673+01
b13a3fb8-2522-4007-b981-603d264dd3a0,Weltherztag,World Heart Day – Ein globaler Aktionstag der World Heart Federation zur Aufklärung über Herz-Kreislauf-Erkrankungen und deren Prävention.,true,"{""day"": 29, ""month"": 9}",INT,2026-01-15 11:48:20.332673+01
1359184f-ee94-40e6-98e3-874bea209966,Internationaler Tag gegen Lebensmittelverschwendung,Ein UN-Tag zur Sensibilisierung für die Reduzierung von Lebensmittelverlusten und -abfällen entlang der gesamten Lieferkette.,true,"{""day"": 29, ""month"": 9}",INT,2026-01-15 11:48:20.332673+01
f12f31f3-8ccb-4a8a-9cc0-1e8827412017,Michaelistag (Erzengel Michael),Ein christlicher Gedenktag zu Ehren des Erzengels Michael; im Volksglauben ein wichtiger Termin für Pachtzahlungen und Bauernregeln.,true,"{""day"": 29, ""month"": 9}",INT,2026-01-15 11:48:20.332673+01
a7082e58-58ff-4bbd-aa6c-18a60e9ff327,Tag des Kaffees (USA/International),"National Coffee Day – In vielen Ländern (u.a. USA) gefeiert, um die Kultur und den Genuss des Kaffees zu würdigen.",true,"{""day"": 29, ""month"": 9}",US/INT,2026-01-15 11:48:20.332673+01
51fa5827-d5d9-4381-90c8-9e06bdd4994c,Tag der Erfinder (Argentinien),"Día del Inventor – Gedenktag am Geburtstag von Ladislao José Biró, dem Erfinder des Kugelschreibers.",true,"{""day"": 29, ""month"": 9}",AR,2026-01-15 11:48:20.332673+01
9fe0f18f-3ca4-493a-8050-78e1d3ff011e,Tag der Marine (Argentinien),Día der Armada Argentina – Gedenktag zu Ehren der Seestreitkräfte des Landes.,true,"{""day"": 29, ""month"": 9}",AR,2026-01-15 11:48:20.332673+01
b0051ca7-bf3e-4db7-bf12-f90d0a5ac3f6,Confucius Day,Gedenktag an den Geburtstag des chinesischen Philosophen Konfuzius (traditionelles Datum).,true,"{""day"": 29, ""month"": 9}",INT,2026-01-15 11:48:20.332673+01
15114aed-fcb9-4b03-a5a5-7b69fc7ac0e9,Internationaler Übersetzertag,Hieronymustag – Würdigt die Arbeit von Sprachmittlern für die Völkerverständigung und den kulturellen Austausch.,true,"{""day"": 30, ""month"": 9}",INT,2026-01-15 11:48:20.332673+01
24d95e64-c909-4835-935d-a2de9c757acc,Loriot-Gedenktag,Geburtstag des bedeutendsten deutschen Humoristen und Satirikers (1923).,true,"{""day"": 14, ""month"": 11}",DE,2026-01-15 17:07:53.269075+01
14d0d916-5247-4400-9aa3-4aff4a2fdee0,Tag der Wahrheit und Versöhnung,Gedenktag an die Opfer des Residential-School-Systems in Kanada und zur Förderung der Heilung zwischen indigenen und nicht-indigenen Völkern.,true,"{""day"": 30, ""month"": 9}",CA,2026-01-15 11:48:20.332673+01
396282c5-002d-4070-83fd-0499ac4ced08,Weltschifffahrtstag (2025/2026),"Wird oft am letzten Donnerstag im September begangen, um die Sicherheit im Seeverkehr und den Umweltschutz auf See zu betonen.",false,"{""month"": 9, ""occurrence"": -1, ""day_of_week"": ""Thursday""}",INT,2026-01-15 11:48:20.332673+01
65b2edaf-951b-476a-b8c2-9a0f402bc379,Tag des heißen Apfelweins,"National Hot Mulled Cider Day – Ein kulinarischer Gedenktag, der perfekt zum Beginn der kühleren Herbsttage passt.",true,"{""day"": 30, ""month"": 9}",INT,2026-01-15 11:48:20.332673+01
233ae6d5-ff69-42d1-a217-7d6df6634e43,Internationaler Podcast-Tag,International Podcast Day – Ein Aktionstag zur Feier der digitalen Audiokultur und der Vielfalt des Podcasting.,true,"{""day"": 30, ""month"": 9}",INT,2026-01-15 11:48:20.332673+01
2bfcba00-e6aa-41c3-be42-a414201f47cf,Tag der Unabhängigkeit (Botswana),Nationalfeiertag zur Erinnerung an die Erlangung der Unabhängigkeit vom Vereinigten Königreich im Jahr 1966.,true,"{""day"": 30, ""month"": 9}",BW,2026-01-15 11:48:20.332673+01
5d9e9738-55d0-4fa1-80e3-c393e9842f39,Gedenktag des Heiligen Hieronymus,"Kirchenvater und Bibelübersetzer (Vulgata); Schutzpatron der Übersetzer, Bibliothekare und Gelehrten.",true,"{""day"": 30, ""month"": 9}",INT,2026-01-15 11:48:20.332673+01
213317d9-0e5a-470e-b9aa-58a8a5357f79,Weltvegetariertag,Ein von der Internationalen Vegetarier-Union ausgerufener Tag zur Förderung der fleischlosen Ernährung und ihrer Vorteile für Umwelt und Gesundheit.,true,"{""day"": 1, ""month"": 10}",INT,2026-01-15 13:38:20.616094+01
4c727723-a4e4-461a-a57c-05832c94b2e0,Internationaler Tag der älteren Menschen,Ein UN-Gedenktag zur Anerkennung der Leistungen Senioren und zur Sensibilisierung für die Herausforderungen des Alterns.,true,"{""day"": 1, ""month"": 10}",INT,2026-01-15 13:38:20.616094+01
d1caf245-b731-47d5-a977-a33c53a00074,Internationaler Musiktag,"Wurde von Yehudi Menuhin initiiert, um die Musik als völkerverbindende Kraft und universelle Sprache zu feiern.",true,"{""day"": 1, ""month"": 10}",INT,2026-01-15 13:38:20.616094+01
5a86c0e0-1a98-46aa-9c90-d857ea596bb8,Internationaler Kaffeetag,Ein Tag zur Feier des Kaffees und zur Unterstützung von fairem Handel für Kaffeebauern weltweit.,true,"{""day"": 1, ""month"": 10}",INT,2026-01-15 13:38:20.616094+01
0d296b12-f0d6-4bc6-9cc8-e6cbf2fc6179,Unabhängigkeitstag (Nigeria),Nationalfeiertag zur Erinnerung an die Erlangung der Souveränität vom Vereinigten Königreich im Jahr 1960.,true,"{""day"": 1, ""month"": 10}",NG,2026-01-15 13:38:20.616094+01
b806436e-9624-4666-8d40-f09e29b0ac55,Unabhängigkeitstag (Zypern),Offizieller Nationalfeiertag zur Feier der staatlichen Souveränität (obwohl die Unabhängigkeit faktisch im August erfolgte).,true,"{""day"": 1, ""month"": 10}",CY,2026-01-15 13:38:20.616094+01
11fe053e-8368-495f-bb0f-b5ecdafc7120,Tag der Unabhängigkeit (Palau),Gedenktag an die Erlangung der Unabhängigkeit im Jahr 1994.,true,"{""day"": 1, ""month"": 10}",PW,2026-01-15 13:38:20.616094+01
23742485-8922-4e13-b8e3-497b881757fd,Gedenktag der Heiligen Thérèse von Lisieux,"Kirchenlehrerin und Patronin der Weltmission, bekannt als ""Die kleine Blume"".",true,"{""day"": 1, ""month"": 10}",INT,2026-01-15 13:38:20.616094+01
70dc84c6-e9e1-4736-ba83-6e9025c61ba9,Internationaler Tag der Gewaltlosigkeit,Ein von der UN ausgerufener Gedenktag am Geburtstag von Mahatma Gandhi zur Verbreitung der Botschaft der Gewaltfreiheit.,true,"{""day"": 2, ""month"": 10}",INT,2026-01-15 13:38:20.616094+01
d257ba55-2bc5-4db6-8191-7c139357313b,Gandhi Jayanti,"Nationalfeiertag in Indien zu Ehren des Geburtstags von Mahatma Gandhi, dem Vater der Nation.",true,"{""day"": 2, ""month"": 10}",IN,2026-01-15 13:38:20.616094+01
09b8bafd-bf84-477b-bac5-e5da54f8edb3,Welttag der Nutztiere,World Day for Farmed Animals – Ein Aktionstag zur Sensibilisierung für das Leid von Tieren in der industriellen Landwirtschaft.,true,"{""day"": 2, ""month"": 10}",INT,2026-01-15 13:38:20.616094+01
4c5d8a94-23b2-4997-8ad7-d5f9088c4faa,Tag der Unabhängigkeit (Guinea),Nationalfeiertag zur Erinnerung an die Unabhängigkeit von Frankreich im Jahr 1958.,true,"{""day"": 2, ""month"": 10}",GN,2026-01-15 13:38:20.616094+01
19f3adcc-bb81-4db8-bb38-a2f5d17f6b12,Name-deines-Autos-Tag,"Name Your Car Day – Ein humorvoller Tag, der Autobesitzer dazu einlädt, ihrem Fahrzeug einen Namen zu geben.",true,"{""day"": 2, ""month"": 10}",INT,2026-01-15 13:38:20.616094+01
a8a5fd1e-ab68-49aa-81f4-aed8baa23a6a,Tag des Friedhofs (Ersatztermin),"Oft im Herbst genutzt, um die Bedeutung von Friedhöfen als Orte der Ruhe, Kultur und Natur zu würdigen.",true,"{""day"": 2, ""month"": 10}",DE,2026-01-15 13:38:20.616094+01
f6139982-0fe2-4b06-a40e-1238d337922c,Gedenktag der heiligen Schutzengel,"Ein katholischer Gedenktag zur Verehrung der Engel, die als Begleiter und Beschützer der Menschen gelten.",true,"{""day"": 2, ""month"": 10}",INT,2026-01-15 13:38:20.616094+01
fba10b0f-309a-4220-82c4-46a94e5fed02,Tag der Friedensstifter,"International Day of Peacekeepers (Ersatztermin) – Zur Würdigung derer, die in Konfliktgebieten für Stabilität sorgen.",true,"{""day"": 2, ""month"": 10}",INT,2026-01-15 13:38:20.616094+01
78acb621-a1ec-49ea-abf4-fe163b56ea5d,Tag der Deutschen Einheit,Nationalfeiertag zur Erinnerung an die Wiedervereinigung Deutschlands im Jahr 1990.,true,"{""day"": 3, ""month"": 10}",DE,2026-01-15 13:38:20.616094+01
1b0000f8-fe26-422b-a366-14e85ee9cab2,Tag der offenen Moschee,Seit 1997 laden Moscheen bundesweit zum Dialog ein; das Datum am Nationalfeiertag wurde bewusst als Zeichen der Verbundenheit gewählt.,true,"{""day"": 3, ""month"": 10}",DE,2026-01-15 13:38:20.616094+01
a504d000-8fd4-457a-af47-f01660dedbb7,Welttag der Architektur,World Architecture Day – Ein Aktionstag zur Würdigung der Arbeit von Architekten (oft am ersten Montag im Oktober).,false,"{""month"": 10, ""occurrence"": 1, ""day_of_week"": ""Monday""}",INT,2026-01-15 13:38:20.616094+01
83bcdad3-a8d5-4e02-973a-33ffe8bff417,Welthabitattag,"World Habitat Day – Ein UN-Tag, um über den Zustand unserer Städte und das Recht auf angemessene Unterkunft zu reflektieren.",false,"{""month"": 10, ""occurrence"": 1, ""day_of_week"": ""Monday""}",INT,2026-01-15 13:38:20.616094+01
c517c85f-ce8a-49f3-9b62-637a5059b8c7,Tag der Unabhängigkeit (Irak),Nationalfeiertag zur Erinnerung an die Erlangung der Souveränität vom britischen Mandat im Jahr 1932.,true,"{""day"": 3, ""month"": 10}",IQ,2026-01-15 13:38:20.616094+01
e13bb4b5-4635-4c8d-83eb-1908df20014f,Gaecheonjeol (Tag der Staatsgründung),Nationalfeiertag in Südkorea zur Feier der Gründung des ersten koreanischen Staates Go-Joseon 2333 v. Chr.,true,"{""day"": 3, ""month"": 10}",KR,2026-01-15 13:38:20.616094+01
594e50f8-3182-44a3-8e8f-d35b9c5839be,Tag des Smoothie,National Smoothie Day – Ein kulinarischer Gedenktag zu Ehren der fruchtigen Mixgetränke.,true,"{""day"": 3, ""month"": 10}",INT,2026-01-15 13:38:20.616094+01
627b9a11-3d8d-43bc-9514-3512917c27b8,Welttierschutztag,"Ein internationaler Aktionstag zur Stärkung der Tierschutzrechte, der am Gedenktag des Franz von Assisi begangen wird.",true,"{""day"": 4, ""month"": 10}",INT,2026-01-15 13:38:20.616094+01
2fe29991-8e79-4cfc-9330-356ebf392b65,Gedenktag des Heiligen Franz von Assisi,Ehrt den Begründer des Franziskanerordens und Patron der Tiere sowie des Umweltschutzes.,true,"{""day"": 4, ""month"": 10}",INT,2026-01-15 13:38:20.616094+01
aa0011bd-7bc8-43a3-8e98-3dcb974876ab,Beginn der Weltraumwoche (World Space Week),Ein von der UN ausgerufener Zeitraum (4.-10.10.) zur Feier der Beiträge von Raumfahrt und Technologie.,true,"{""day"": 4, ""month"": 10}",INT,2026-01-15 13:38:20.616094+01
c36d79ed-b973-4b74-b59c-0bdd6e4263cb,Kanelbullens dag (Tag der Zimtschnecke),Ein in Schweden und Finnland tief verwurzelter kulinarischer Feiertag zu Ehren des berühmten Gebäcks.,true,"{""day"": 4, ""month"": 10}",SE/FI,2026-01-15 13:38:20.616094+01
c881719f-51f0-4d13-84d3-04da0fb7505f,Tag der Unabhängigkeit (Lesotho),Nationalfeiertag zur Erinnerung an die Erlangung der Souveränität vom Vereinigten Königreich im Jahr 1966.,true,"{""day"": 4, ""month"": 10}",LS,2026-01-15 13:38:20.616094+01
b09666b2-70fd-4cf0-81a0-47bde16a4444,Tag des Wodkas,"National Vodka Day – Ein kulinarischer Gedenktag, der die Geschichte und Vielfalt der Spirituose feiert.",true,"{""day"": 4, ""month"": 10}",INT,2026-01-15 13:38:20.616094+01
242ba422-bd6a-4a5e-af3d-3426615fac30,Tag des Taco (US-Termin),"National Taco Day – Ein Genusstag für die mexikanische Spezialität, der in den USA besonders zelebriert wird.",true,"{""day"": 4, ""month"": 10}",US,2026-01-15 13:38:20.616094+01
8eedf80b-dd3f-42e6-a943-73ba1f393a37,Weltlehrertag,"Ein von der UNESCO ausgerufener Tag, um die wichtige Rolle von Lehrkräften für eine qualitativ hochwertige Bildung zu würdigen.",true,"{""day"": 5, ""month"": 10}",INT,2026-01-15 13:38:20.616094+01
f06713e5-dc46-4015-836b-8818c9565015,Erntedankfest (2025),Traditionelles Fest nach der Ernte; in Deutschland meist am ersten Sonntag im Oktober gefeiert.,false,"{""month"": 10, ""occurrence"": 1, ""day_of_week"": ""Sunday""}",DE/AT/CH,2026-01-15 13:38:20.616094+01
e66f8343-3578-46be-9aec-4a9c0833f80a,Tag der Republik (Portugal),Implantação da República – Nationalfeiertag zur Erinnerung an den Sturz der Monarchie und die Ausrufung der Republik im Jahr 1910.,true,"{""day"": 5, ""month"": 10}",PT,2026-01-15 13:38:20.616094+01
5a5e5fe3-9376-46f9-8d58-904fec83923e,Tag der Seifenblase,"National Do Something Nice Day / Bubble Day – Ein verspielter Tag, der dazu einlädt, Freude durch kleine Gesten zu verbreiten.",true,"{""day"": 5, ""month"": 10}",INT,2026-01-15 13:38:20.616094+01
203944a0-ce2f-4d20-9325-71d5126e2305,Welttag der Lehrer (Ersatztermin),World Teachers Day – In vielen Ländern ein schulfreier Ehrentag für das pädagogische Personal.,true,"{""day"": 5, ""month"": 10}",INT,2026-01-15 13:38:20.616094+01
a217452c-ceeb-459a-8686-21b28567ba31,Tag der Apple-Mitarbeiter (Steve Jobs Gedenktag),Todestag des Apple-Gründers (2011); wird von Fans oft als Tag der Innovation begangen.,true,"{""day"": 5, ""month"": 10}",INT,2026-01-15 13:38:20.616094+01
8f532fc0-08b9-4948-a5fc-469330d62d67,Gedenktag der Heiligen Maria Faustyna Kowalska,Bekannt als Apostelin der Barmherzigkeit; eine bedeutende polnische Ordensfrau und Mystikerin.,true,"{""day"": 5, ""month"": 10}",INT,2026-01-15 13:38:20.616094+01
2723713f-851b-4c60-b6db-5edf5fb62f1f,German-American Day,Ein US-Gedenktag zur Erinnerung an die Gründung von Germantown 1683 und das deutsche Erbe in den Vereinigten Staaten.,true,"{""day"": 6, ""month"": 10}",US,2026-01-15 13:38:20.616094+01
9a1fb428-09e0-4539-9bd0-b49d1c298c81,Welttag des Lächelns,"World Smile Day – Ein Tag, der dazu aufruft, durch ein Lächeln und eine freundliche Tat die Welt ein Stück besser zu machen (meist 1. Freitag im Okt.).",false,"{""month"": 10, ""occurrence"": 1, ""day_of_week"": ""Friday""}",INT,2026-01-15 13:38:20.616094+01
